<?xml version="1.0" encoding="UTF-8"?>
<?xml-stylesheet type='text/xsl' href='../../../../../../../../../../test.xsl'?>
<!--
    Licensed to the Apache Software Foundation (ASF) under one or more
    contributor license agreements.  See the NOTICE file distributed with
    this work for additional information regarding copyright ownership.
    The ASF licenses this file to You under the Apache License, Version 2.0
    (the "License"); you may not use this file except in compliance with
    the License.  You may obtain a copy of the License at
  
       http://www.apache.org/licenses/LICENSE-2.0
  
    Unless required by applicable law or agreed to in writing, software
    distributed under the License is distributed on an "AS IS" BASIS,
    WITHOUT WARRANTIES OR CONDITIONS OF ANY KIND, either express or implied.
    See the License for the specific language governing permissions and
    limitations under the License.
-->
<!DOCTYPE Test SYSTEM '../../../../../../../../../../test.dtd'>
<Test
    ID="F_FloatTest_01"
    date-of-creation="2004-11-24"
    timeout="1"
    >
    <!--
    -->
        
        
        <APITestDescription>
            <TestedClass name="java.lang.Float"/>
            <TestedMethod name="public Float(float value)"/>
            <TestedMethod name="public boolean equals(Object obj)"/>
            <TestedMethod name="public float floatValue()"/>
            <TestedMethod name="public static boolean isInfinite(float v)"/>
            <TestedMethod name="public static boolean isNaN(float v)"/>
            <TestedMethod name="public static String toString(float f)"/>
            <TestedMethod name="public static Float valueOf(String s)"/>
        
            <Description>
                Check correctness of types contvertations for Float.
            </Description>
        </APITestDescription>

        <Keyword name="functional"/>
        <Source name="F_FloatTest_01.java"/>
        <Modification date="2004-11-24" />

        <Runner ID="Runtime">
            <Param name="toRun" value="org.apache.harmony.test.func.api.java.lang.F_FloatTest_01.F_FloatTest_01"></Param>
        </Runner>
</Test> 