<?xml version="1.0" encoding="UTF-8"?>
<!--
    Copyright 2005-2006 The Apache Software Foundation or its licensors, as applicable

    Licensed under the Apache License, Version 2.0 (the "License");
    you may not use this file except in compliance with the License.
    You may obtain a copy of the License at

       http://www.apache.org/licenses/LICENSE-2.0

    Unless required by applicable law or agreed to in writing, software
    distributed under the License is distributed on an "AS IS" BASIS,
    WITHOUT WARRANTIES OR CONDITIONS OF ANY KIND, either express or implied.

    See the License for the specific language governing permissions and
    limitations under the License.
-->
<!DOCTYPE Test SYSTEM "test.dtd">
<!--
Author: Ilia A. Leviev
Version: $Revision: 1.4 $
-->
<Test
  ID="ldc_w0504"
  date-of-creation="2005-04-29"
  timeout="1"
  >
  <Author value="Ilia A. Leviev"/>
  <Description>
    The test is against the ldc_w java virtual machine instruction. 
    It performs the following check.     
    The VerifyError is thrown if constant type of value at index  is CONSTANT_Utf8.
   Covered assertions assert_class633 assert_instr28a089
</Description>

  <Keyword name="verifier"/>

  

  <Source name="ldc_w0504n.ccodeh"/>

  <Runner ID="Runtime">
    <Param name="toRun" value="org.apache.harmony.vts.test.vm.jvms.share.vmVerifierRun">
      <Option name="load"/>
      <Option name="org.apache.harmony.vts.test.vm.jvms.instructions.loadStore.ldc_w.ldc_w05.ldc_w0504.ldc_w0504n"/>
      <Option name="java.lang.VerifyError"/>
    </Param>
  </Runner>
</Test>
