<?xml version="1.0" encoding="UTF-8"?>
<!--
    Copyright 2005-2006 The Apache Software Foundation or its licensors, as applicable

    Licensed under the Apache License, Version 2.0 (the "License");
    you may not use this file except in compliance with the License.
    You may obtain a copy of the License at

       http://www.apache.org/licenses/LICENSE-2.0

    Unless required by applicable law or agreed to in writing, software
    distributed under the License is distributed on an "AS IS" BASIS,
    WITHOUT WARRANTIES OR CONDITIONS OF ANY KIND, either express or implied.

    See the License for the specific language governing permissions and
    limitations under the License.
-->
<!DOCTYPE Test SYSTEM "test.dtd">
<!--
Author:  Alexander V. Esin
Version: $Revision: 1.2 $
-->
<Test
  ID="sourceDebugExtension05"
  date-of-creation="2006-06-29"
  timeout="1"
  >
  <Author value="Alexander V. Esin"/>
  <Description>
    Checks that ClassFormatError is thrown on loading a class file which has 
    SourceDebugExtension attribute in class info structure which has attribute_length 
    item less than size of debug_extension[] array
    Negative testcase.
    Covered assertions assert_class548_04
  </Description>

  <Keyword name="JVMS3ed_specific"/>

  <Source name="sourceDebugExtension05n.ccode"/>

  <Runner ID="Runtime">
    <Param name="toRun" value="org.apache.harmony.vts.test.vm.jvms.share.vmVerifierRun">
          <Option name="load"/>
          <Option name="org.apache.harmony.vts.test.vm.jvms.classFile.attributes.sourceDebugExtension.sourceDebugExtension05.sourceDebugExtension05n"/>
          <Option name="java.lang.ClassFormatError"/>
    </Param>
  </Runner>
</Test>
