<?xml version="1.0" encoding="UTF-8"?>
<!--
 Licensed to the Apache Software Foundation (ASF) under one
 or more contributor license agreements.  See the NOTICE file
 distributed with this work for additional information
 regarding copyright ownership.  The ASF licenses this file
 to you under the Apache License, Version 2.0 (the
 "License"); you may not use this file except in compliance
 with the License.  You may obtain a copy of the License at

   http://www.apache.org/licenses/LICENSE-2.0

 Unless required by applicable law or agreed to in writing,
 software distributed under the License is distributed on an
 "AS IS" BASIS, WITHOUT WARRANTIES OR CONDITIONS OF ANY
 KIND, either express or implied.  See the License for the
 specific language governing permissions and limitations
 under the License.
-->
<!DOCTYPE Test SYSTEM "test.dtd">
<!--
Author: Vera Y.Petrashkova
Version: $Revision: 1.5 $
-->
<Test
	ID="testCFE_RBytes2"
        date-of-creation="2005-11-14"
        timeout="1">
    	<Copyright value="apache"/>
        <Author value="Vera Y. Petrashkova"/>
        <Description>
            Start a lot of threads which
	         - try to load a lot of wrong classes;
        	This performance is repeated several times.
        	Parameters: 0 - used mode
        	            1 - number of iterations
        	            2 - number of threads
        	            3 - number of iterations for classes loading
        	            4 - number of used classesd
        	            5 - location of used classes 
        </Description>
        <Keyword name="stress"/>
        <Source name="testCFE_RBytes.java"/>        
        <Source name="../../share/WrongClasses/testCFE_RBytes_00.java"/>        
        <Source name="../../share/WrongClasses/testCFE_RBytes.java"/>                
        <Runner ID="Runtime">
            <Option value="-Dorg.apache.harmony.test.share.stress.ReliabilityRunner.params=
					org.apache.harmony.test.stress.classloader.MixThreads.WrongClasses.testCFE_RBytes {}"/>
            <Option value="-Dorg.apache.harmony.test.stress.classloader.MixThreads.WrongClasses.testCFE_RBytes.arg0=1"/>
            <Option value="-Dorg.apache.harmony.test.stress.classloader.MixThreads.WrongClasses.testCFE_RBytes.arg1=2"/>
            <Option value="-Dorg.apache.harmony.test.stress.classloader.MixThreads.WrongClasses.testCFE_RBytes.arg2=5"/>
            <Option value="-Dorg.apache.harmony.test.stress.classloader.MixThreads.WrongClasses.testCFE_RBytes.arg3=100"/>
            <Option value="-Dorg.apache.harmony.test.stress.classloader.MixThreads.WrongClasses.testCFE_RBytes.arg4=5"/>
            <Option value="-Dorg.apache.harmony.test.stress.classloader.MixThreads.WrongClasses.testCFE_RBytes.arg5=$TestSuiteRoot/bin/classes"/>
		<Param name="toRun" value="org.apache.harmony.test.share.stress.ReliabilityRunner">
		</Param>
		</Runner>
		<Restriction name="OtherVMOnly"/>
</Test>