<?xml version="1.0" encoding="UTF-8"?>
<?xml-stylesheet type='text/xsl' href='../../../../../../../../../../../test.xsl'?>
<!--
    Licensed to the Apache Software Foundation (ASF) under one or more
    contributor license agreements.  See the NOTICE file distributed with
    this work for additional information regarding copyright ownership.
    The ASF licenses this file to You under the Apache License, Version 2.0
    (the "License"); you may not use this file except in compliance with
    the License.  You may obtain a copy of the License at
  
       http://www.apache.org/licenses/LICENSE-2.0
  
    Unless required by applicable law or agreed to in writing, software
    distributed under the License is distributed on an "AS IS" BASIS,
    WITHOUT WARRANTIES OR CONDITIONS OF ANY KIND, either express or implied.
    See the License for the specific language governing permissions and
    limitations under the License.
-->
<!DOCTYPE Test SYSTEM '../../../../../../../../../../../test.dtd'>
<Test
    ID="F_ReflectionTest_04"
    date-of-creation="2004-12-08"
    timeout="1"
    >
    <!--
    -->
        
        
        <APITestDescription>
            <TestedClass name="java.lang.ClassLoader"/>
            <TestedMethod name="protected ClassLoader()"/>
            <TestedMethod name="public Class&lt;?&gt; loadClass(String name) throws ClassNotFoundException"/>
            
            <TestedClass name="java.lang.Class"/>
            <TestedMethod name="public Constructor&lt;T&gt; getConstructor(Class... parameterTypes) throws NoSuchMethodException, SecurityException"/>
            <TestedMethod name="public boolean isInstance(Object obj)"/>
            
            <TestedClass name="java.lang.reflect.Array"/>
            <TestedMethod name="public static Object newInstance(Class&lt;?&gt; componentType, int length) throws NegativeArraySizeException"/>
            <TestedMethod name="public static int getLength(Object array)"/>
            <TestedMethod name="public static void set(Object array, int index, Object value)"/>
            <TestedMethod name="public static Object get(Object array, int index)"/>
            
            <TestedClass name="java.lang.reflect.Constructor"/>
            <TestedMethod name="public Class&lt;?&gt; getDeclaringClass()"/>
            <TestedMethod name="public T newInstance(Object... initargs) throws InstantiationException, IllegalAccessException, IllegalArgumentException, InvocationTargetException"/>
        
            <Description>
                Create array of objects of dynamically loading class for testing Array and Constructor.
            </Description>
        </APITestDescription>

        <Keyword name="functional"/>
        <Source name="F_ReflectionTest_04.java"/>
        <Modification date="2004-12-21" />

        <Runner ID="Runtime">
            <Param name="toRun" value="org.apache.harmony.test.func.api.java.lang.reflect.F_ReflectionTest_04.F_ReflectionTest_04"></Param>
        </Runner>
</Test> 