<?xml version="1.0" encoding="UTF-8"?>
<!--
    Copyright 2005-2006 The Apache Software Foundation or its licensors, as applicable

    Licensed under the Apache License, Version 2.0 (the "License");
    you may not use this file except in compliance with the License.
    You may obtain a copy of the License at

       http://www.apache.org/licenses/LICENSE-2.0

    Unless required by applicable law or agreed to in writing, software
    distributed under the License is distributed on an "AS IS" BASIS,
    WITHOUT WARRANTIES OR CONDITIONS OF ANY KIND, either express or implied.

    See the License for the specific language governing permissions and
    limitations under the License.
-->
<!DOCTYPE Test SYSTEM "test.dtd">
<!--
Author: Petr Ivanov
Version: $Revision: 1.3 $
-->

<Test
    ID="DeleteLocalRefTest"
    date-of-creation="11-02-2005"
    timeout="1"
    >   
        <Author value="Petr Ivanov"/>
        <Description>
            <TestedMethod name="DeleteLocalRef()"/>
            Test creates the local object in native and creates a weak ref
            to it, then deletes this local ref and invokes System.gc(); 
            then it compares the object that is referenced by weak ref with null
            and thereby checks that this object have been GC'ed.

            Covered assertions assert_func106
        </Description>
        <Keyword name="functional"/>    
        <Source name="DeleteLocalRefTest.java"/>
            
        <Runner ID="Runtime">
            <Param name="toRun" value="org.apache.harmony.vts.test.vm.jni.references.DeleteLocalRefTest"/>
        </Runner>
</Test>
