<?xml version="1.0" encoding="UTF-8"?>
<?xml-stylesheet type='text/xsl' href='../../../../../../../../../test.xsl'?>
<!--
    Licensed to the Apache Software Foundation (ASF) under one or more
    contributor license agreements.  See the NOTICE file distributed with
    this work for additional information regarding copyright ownership.
    The ASF licenses this file to You under the Apache License, Version 2.0
    (the "License"); you may not use this file except in compliance with
    the License.  You may obtain a copy of the License at
  
       http://www.apache.org/licenses/LICENSE-2.0
  
    Unless required by applicable law or agreed to in writing, software
    distributed under the License is distributed on an "AS IS" BASIS,
    WITHOUT WARRANTIES OR CONDITIONS OF ANY KIND, either express or implied.
    See the License for the specific language governing permissions and
    limitations under the License.
-->
<!DOCTYPE Test SYSTEM '../../../../../../../../../test.dtd'>
<Test ID="Btest10305" date-of-creation="2006-10-27" timeout="1">
    
    
    
    <Description>
        (JIT_debug: SINGLE_STEP does not work for constructor of java.lang.Object)
    </Description>
    <Keyword name="regression"/>  
    
    <Source name="Btest10305.java"/>
    <Source name="Btest10305.cpp"/>
    
    <Runner ID="Execute">
        <Param name="toRun" value="$TestedRuntime">
            <Option name="-cp" value="$CP"/>
            <Option name="-agentlib:Btest10305"/>
            <Option name="org.apache.harmony.test.func.reg.vm.btest10305.Btest10305"/>
        </Param>        
    </Runner>                               

</Test>
