<?xml version="1.0" encoding="UTF-8"?>
<?xml-stylesheet type='text/xsl' href='../../../../../../../../../../../test.xsl'?>
<!--
    Licensed to the Apache Software Foundation (ASF) under one or more
    contributor license agreements.  See the NOTICE file distributed with
    this work for additional information regarding copyright ownership.
    The ASF licenses this file to You under the Apache License, Version 2.0
    (the "License"); you may not use this file except in compliance with
    the License.  You may obtain a copy of the License at
  
       http://www.apache.org/licenses/LICENSE-2.0
  
    Unless required by applicable law or agreed to in writing, software
    distributed under the License is distributed on an "AS IS" BASIS,
    WITHOUT WARRANTIES OR CONDITIONS OF ANY KIND, either express or implied.
    See the License for the specific language governing permissions and
    limitations under the License.
-->
<!DOCTYPE Test SYSTEM '../../../../../../../../../../../test.dtd'>
<!--
-->
<Test
    ID="GranularityTest"
        date-of-creation="2006-03-03"
        timeout="2">
        
        
    <APITestDescription>
        <TestedClass name="javax.management.monitor.CounterMonitor"/>
        <TestedMethod name="public void setGranularityPeriod(long period)"/>
        <TestedMethod name="public void setInitThreshold(Number value)"/>
        <TestedMethod name="public void setModulus(Number value)"/>
        <TestedMethod name="public void setNotify(boolean value)"/>
        <TestedMethod name="public void start()"/>
        <TestedMethod name="public void stop()"/>
        
        <TestedClass name="javax.management.NotificationBroadcasterSupport"/>
        <TestedMethod
            name="public void addNotificationListener(NotificationListener listener,NotificationFilter filter,Object handback)"/>
            
        <TestedClass name="javax.management.monitor.Monitor"/>
        <TestedMethod name="public void addObservedObject(ObjectName object)"/>
        <TestedMethod name="public void setObservedAttribute(String attribute)"/>
        <Description>
            This test verifies setGranularityPeriod method.
            Step by step:
                1. Create the monitor and observed MBean objects. The Monitor and
                Observed MBean has the same granularity period(GP), but the shifted 
                to GP/2 value
                2. After waiting for a reasonable time(~5*GP), change monitors
                granularity period to GP/10 and receive the corresponding notification
        </Description>
    </APITestDescription>        
        <Keyword name="functional"/>
        <Source name="GranularityTest.java"/>        
        <Runner ID="Runtime">
            <Param name="toRun" value="org.apache.harmony.test.func.api.javax.management.monitor.countermonitor.GranularityTest">

            </Param>
        </Runner>
        <Restriction name="OtherVMOnly"/>
</Test>

