<?xml version="1.0" encoding="UTF-8"?>
<?xml-stylesheet type='text/xsl' href='../../../../../../../../../../test.xsl'?>
<!--
    Licensed to the Apache Software Foundation (ASF) under one or more
    contributor license agreements.  See the NOTICE file distributed with
    this work for additional information regarding copyright ownership.
    The ASF licenses this file to You under the Apache License, Version 2.0
    (the "License"); you may not use this file except in compliance with
    the License.  You may obtain a copy of the License at
  
       http://www.apache.org/licenses/LICENSE-2.0
  
    Unless required by applicable law or agreed to in writing, software
    distributed under the License is distributed on an "AS IS" BASIS,
    WITHOUT WARRANTIES OR CONDITIONS OF ANY KIND, either express or implied.
    See the License for the specific language governing permissions and
    limitations under the License.
-->
<!DOCTYPE Test SYSTEM '../../../../../../../../../../test.dtd'>
<Test
    ID="F_AccessControlContextTest_01"
    date-of-creation="2004-12-06"
    timeout="1"
    >
    <!--
    -->
            
                
                <APITestDescription>
                    <TestedClass name="java.security.AccessController"/>
                    <TestedMethod name="public static AccessControlContext getContext()"/>
                    <TestedMethod name="public static &lt;T&gt; T doPrivileged(PrivilegedAction&lt;T&gt; action)"/>

                    <TestedClass name="java.security.AccessControlContext"/>
                    <TestedMethod name="public AccessControlContext(ProtectionDomain[] context)"/>
                    <TestedMethod name="public AccessControlContext(AccessControlContext acc, DomainCombiner combiner)"/>

                    <TestedClass name="java.security.Policy"/>
                    <TestedMethod name="public static Policy getPolicy()"/>
                    <TestedMethod name="public PermissionCollection getPermissions(ProtectionDomain domain)"/>

                    <TestedClass name="java.security.ProtectionDomain"/>
                    <TestedMethod name="public ProtectionDomain(CodeSource codesource, PermissionCollection permissions, ClassLoader classloader, Principal[] principals)"/>                    
                    <TestedMethod name="public final CodeSource getCodeSource()"/>

                    <TestedClass name="java.security.PermissionCollection"/>
                    <TestedMethod name="public PermissionCollection()"/>

                    <TestedClass name="java.security.Security"/>
                    <TestedMethod name="public static String getProperty(String key)"/>

                    <TestedClass name="java.security.Permissions"/>
                    <TestedMethod name="public Enumeration&lt;Permission&gt; elements()"/>

                    <Description>
                        Check AccessControlContext security mechanism.
                    </Description>
                </APITestDescription>
                
                <Keyword name="functional"/>
                <Source name="F_AccessControlContextTest_01.java"/>
                <Modification date="2004-12-06" />                

        <Runner ID="Runtime">
                <Option name="-cp" value="$CP$PathSeparator$TestSuiteClassRoot$PathSeparator"/>
                   <Option name="-Djava.security.policy==$TestDirectory$FileSeparatorauxiliary$FileSeparatorAccessControlContext01.policy"/>
                   <Option name="-Dqe.suite=$TestSuiteRoot"/>
                   <Option name="-Dqe.class=$TestSuiteClassRoot"/>
                   <Option name="-Dqe.src=$TestSuiteTestRoot"/>
            <Param name="toRun" value="org.apache.harmony.test.func.api.java.security.F_AccessControlContextTest_01.F_AccessControlContextTest_01"/>
                
        </Runner>
        <Restriction name="OtherVMOnly"/>

</Test>